{"schema_version":"grounding-hypotheses.v1","protocol":"worldeval-conversation/0.1.0","hypothesis_set_id":"hypotheses-1","task_id":"task-1","conversation_id":"warehouse-chat-1","command_message_id":"message-1","source":{"observation_seq":4,"tick":12,"state_hash":"sha256:1111111111111111111111111111111111111111111111111111111111111111"},"status":"resolved","selected_candidate_id":"candidate-blue-box","candidates":[{"candidate_id":"candidate-blue-box","entity":{"entity_id":"box-blue-1","generation":1,"type_id":"box"},"visible_evidence":{"observation_seq":4,"tick":12,"state_hash":"sha256:1111111111111111111111111111111111111111111111111111111111111111","visible_entity_id":"box-blue-1","generation":1}}]}
